[
  {
    "organizer_id": 1,
    "organizer_name": "Alice Conrado",
    "title": "Introduction to Robotics",
    "description": "Step into the future with our 'Introduction to Robotics' workshop, held at the innovative Tech World Center. From 11:00 AM to 1:00 PM on October 3, 2024, join us for a hands-on, interactive experience designed to demystify the world of robotics. This workshop is tailored for enthusiasts of all backgrounds, offering a comprehensive introduction to the basics of robot construction and programming. You'll learn how to assemble robotic kits from scratch, explore the fundamental principles of electronics and mechanical design, and write simple programs to control your creations. Our expert instructors will guide you through each stage, from understanding sensors and actuators to deploying your robot in exciting challenges. The Tech World Center, located at 12 Innovation Road, Manchester, provides the perfect environment with state-of-the-art facilities to foster learning and creativity. For just £30.00, you'll not only gain valuable skills but also have fun discovering how robots can be both functional and fascinating. This workshop is ideal for anyone looking to dip their toes into the world of robotics and is sure to spark a lifelong interest in technology.",
    "start_time": "11:00",
    "end_time": "13:00",
    "date": "03-10-2024",
    "venue": "Tech World Center",
    "price": "30.00",
    "address": "12 Innovation Road",
    "post_code": "M19BT",
    "city": "Manchester"
  },
  {
    "organizer_id": 2,
    "organizer_name": "Mark Anthony",
    "title": "Advanced Guitar Lessons",
    "description": "Elevate your guitar skills to new heights with our 'Advanced Guitar Lessons,' hosted at the prestigious Strum Music Academy. From 5:00 PM to 7:00 PM on September 22, 2024, this weekly class is designed for dedicated guitarists ready to dive deep into advanced techniques and musical styles. Under the guidance of Mark Anthony, a distinguished guitarist known for his mastery of multiple genres, you will explore intricate fingerstyle techniques, advanced chord voicings, and complex soloing methods. Each lesson is crafted to challenge and inspire, offering a blend of technical exercises and creative exploration. You’ll also delve into the nuances of improvisation, music theory, and personal expression, gaining the tools to enhance your performance skills. Located at 45 Melody Lane, Salford, Strum Music Academy provides a vibrant atmosphere perfect for honing your craft. At just £18.50 per session, these lessons offer exceptional value for those serious about refining their guitar skills and pushing their musical boundaries.",
    "start_time": "17:00",
    "end_time": "19:00",
    "date": "22-09-2024",
    "venue": "Strum Music Academy",
    "price": "18.50",
    "address": "45 Melody Lane",
    "post_code": "M20DJ",
    "city": "Salford"
  },
  {
    "organizer_id": 3,
    "organizer_name": "Rafael Alessandro",
    "title": "Photography Walk: Nature Edition",
    "description": "Embark on a visual adventure with our 'Photography Walk: Nature Edition,' taking place at the picturesque Green Park on September 16, 2024. From 9:00 AM to 11:30 AM, join renowned photographer Rafael Alessandro for a guided tour that will help you capture the breathtaking beauty of the natural world through your lens. This free event offers an opportunity to explore the park’s lush landscapes, vibrant flora, and serene wildlife while learning valuable photography techniques. Rafael will provide personalized tips on composition, lighting, and camera settings, ensuring that you can make the most of the stunning surroundings. Whether you are an amateur photographer or a seasoned pro, this walk will offer fresh perspectives and inspiration. As you wander along trails and through meadows, you’ll have the chance to snap unique shots and refine your skills in a supportive, creative environment. Located at 27 Forest Walk, Bolton, Green Park is the perfect backdrop for this engaging and educational experience.",
    "start_time": "09:00",
    "end_time": "11:30",
    "date": "16-09-2024",
    "venue": "Green Park",
    "price": "Free",
    "address": "27 Forest Walk",
    "post_code": "M25QP",
    "city": "Bolton"
  },
  {
    "organizer_id": 4,
    "organizer_name": "Alba Martines",
    "title": "Basic First Aid Training",
    "description": "Join us for a crucial 'Basic First Aid Training' session at the Health and Safety Institute on September 29, 2024. From 1:00 PM to 3:00 PM, this free workshop is designed to equip you with essential first aid skills that could make all the difference in an emergency. Led by the experienced Alba Martines, you will learn how to assess and respond to various medical situations with confidence. The training covers vital topics such as CPR (Cardiopulmonary Resuscitation), wound care, choking relief, and the basics of dealing with burns and fractures. Through practical demonstrations and hands-on exercises, you will gain the knowledge needed to handle emergencies effectively. The Health and Safety Institute, located at 58 Safety Avenue, Stockport, offers a supportive environment for learning these life-saving techniques. Whether you're a concerned parent, a workplace safety officer, or just interested in being prepared, this workshop provides valuable skills at no cost.",
    "start_time": "13:00",
    "end_time": "15:00",
    "date": "29-09-2024",
    "venue": "Health and Safety Institute",
    "price": "Free",
    "address": "58 Safety Avenue",
    "post_code": "M12HS",
    "city": "Stockport"
  },
  {
    "organizer_id": 5,
    "organizer_name": "Fred Smith",
    "title": "Pottery Workshop for Beginners",
    "description": "Unleash your inner artist with our 'Pottery Workshop for Beginners,' taking place at the Clay Studio on October 5, 2024. From 10:00 AM to 12:30 PM, this free workshop invites you to explore the art of pottery in a fun and relaxed setting. Led by the talented Fred Smith, you'll receive step-by-step guidance on shaping, molding, and glazing your own ceramic creations. The workshop covers the basics of hand-building techniques, including pinch pots, coil construction, and slab building. You’ll also learn about the pottery wheel, if you're feeling adventurous. By the end of the session, you'll have crafted your own unique piece of pottery to take home, along with a newfound appreciation for this timeless craft. The Clay Studio, situated at 89 Art Street, Rochdale, provides all the materials you need, making this a perfect introduction to the world of pottery. Join us for a creative and satisfying experience that promises to ignite your artistic spirit.",
    "start_time": "10:00",
    "end_time": "12:30",
    "date": "05-10-2024",
    "venue": "Clay Studio",
    "price": "Free",
    "address": "89 Art Street",
    "post_code": "M30BG",
    "city": "Rochdale"
  },
  {
    "organizer_id": 1,
    "organizer_name": "Alice Conrado",
    "title": "Wine Tasting Evening",
    "description": "Indulge your senses at our 'Wine Tasting Evening,' hosted at the elegant Vineyard Hall on September 25, 2024. From 7:00 PM to 9:00 PM, this event offers a delightful opportunity to experience a curated selection of fine wines in a relaxed and sociable atmosphere. Alice Conrado, our expert sommelier, will guide you through an array of exquisite wines, providing insights into their origins, flavor profiles, and ideal pairings. You’ll savor a range of varietals, from crisp whites to robust reds, and enjoy complimentary cheese and hors d'oeuvres to enhance your tasting experience. The Vineyard Hall, located at 16 Grape Street, Oldham, sets the perfect backdrop for an evening of refined enjoyment and convivial conversation. For just £15.00, you’ll not only expand your palate but also gain a deeper appreciation for the art of wine tasting. Whether you're a wine aficionado or a curious novice, this event promises an enriching and enjoyable experience.",
    "start_time": "19:00",
    "end_time": "21:00",
    "date": "25-09-2024",
    "venue": "Vineyard Hall",
    "price": "15.00",
    "address": "16 Grape Street",
    "post_code": "M6WR",
    "city": "Oldham"
  },
  {
    "organizer_id": 2,
    "organizer_name": "Mark Anthony",
    "title": "Jazz Dance Workshop",
    "description": "Get ready to groove at our 'Jazz Dance Workshop,' taking place at the Dance Fusion Studio on September 28, 2024. From 6:00 PM to 8:00 PM, join the dynamic Mark Anthony for an energetic and fun-filled evening dedicated to the vibrant world of jazz dance. This workshop is perfect for beginners looking to dive into the fundamentals of jazz dance, including key movements, rhythms, and styling. Mark will lead you through a series of exciting routines and exercises designed to enhance your coordination, flexibility, and rhythm. With a focus on both technique and expression, you'll learn how to bring your own flair to the dance floor. The Dance Fusion Studio, located at 23 Rhythm Road, Bury, provides a lively and supportive environment to let your dancing spirit shine. At just £10.00, this workshop is an excellent value for anyone eager to explore jazz dance and have a blast while doing it.",
    "start_time": "18:00",
    "end_time": "20:00",
    "date": "28-09-2024",
    "venue": "Dance Fusion Studio",
    "price": "10.00",
    "address": "23 Rhythm Road",
    "post_code": "M42TR",
    "city": "Bury"
  },
  {
    "organizer_id": 3,
    "organizer_name": "Rafael Alessandro",
    "title": "Public Speaking for Beginners",
    "description": "Overcome your fear of public speaking and unlock your potential at our 'Public Speaking for Beginners' workshop, held at Speaker's Corner on September 30, 2024. From 3:00 PM to 5:00 PM, join Rafael Alessandro for an engaging and empowering session designed to build your confidence and enhance your presentation skills. This free workshop is perfect for anyone looking to improve their public speaking abilities, whether for personal growth, professional development, or academic purposes. Rafael will cover essential techniques, including effective speech delivery, overcoming nervousness, and engaging your audience. You’ll participate in practical exercises and receive personalized feedback to help you refine your speaking style. Speaker's Corner, located at 34 Orator Avenue, Wigan, provides an encouraging and interactive setting for this valuable learning experience. Equip yourself with the skills to speak with confidence and make a lasting impression in any situation.",
    "start_time": "15:00",
    "end_time": "17:00",
    "date": "30-09-2024",
    "venue": "Speaker's Corner",
    "price": "Free",
    "address": "34 Orator Avenue",
    "post_code": "M55HT",
    "city": "Wigan"
  },
  {
    "organizer_id": 4,
    "organizer_name": "Alba Martines",
    "title": "Creative Coding for Kids",
    "description": "Dive into the exciting world of programming with our 'Creative Coding for Kids' workshop, held at CodeLab on September 12, 2024. From 10:30 AM to 12:00 PM, this engaging and interactive session, priced at just £5.00, introduces young minds to the fundamentals of coding in a fun and accessible way. Alba Martines will guide children through basic programming concepts using colorful and intuitive tools designed specifically for beginners. Through hands-on activities and playful challenges, kids will learn how to create their own simple games, animations, and interactive stories. The workshop fosters creativity and problem-solving skills, all while providing a foundation in coding that can spark a lifelong interest in technology. Set in the vibrant CodeLab, located at 5 Byte Boulevard, Ashton-under-Lyne, this event promises to be both educational and entertaining. Join us for a morning of learning and fun that will inspire the next generation of tech enthusiasts.",
    "start_time": "10:30",
    "end_time": "12:00",
    "date": "12-09-2024",
    "venue": "CodeLab",
    "price": "5.00",
    "address": "5 Byte Boulevard",
    "post_code": "M11CV",
    "city": "Ashton-under-Lyne"
  },
  {
    "organizer_id": 5,
    "organizer_name": "Fred Smith",
    "title": "Local History Tour",
    "description": "Step back in time and discover the rich tapestry of local heritage with our 'Local History Tour,' hosted by Fred Smith at the Heritage Museum on October 7, 2024. Running from 2:00 PM to 4:00 PM, this informative and immersive walking tour is available for just £7.00. As you stroll through the historic streets of Altrincham, Fred will share fascinating stories and insights about the area's past, from its early beginnings to significant events that shaped the community. The tour includes visits to notable landmarks and hidden gems, offering a deeper understanding of local history and culture. The Heritage Museum, located at 80 Heritage Lane, provides a perfect starting point for this journey through time. Whether you're a history buff or simply curious about your surroundings, this tour is a wonderful opportunity to connect with the past and appreciate the history that surrounds us.",
    "start_time": "14:00",
    "end_time": "16:00",
    "date": "07-10-2024",
    "venue": "Heritage Museum",
    "price": "7.00",
    "address": "80 Heritage Lane",
    "post_code": "M34TS",
    "city": "Altrincham"
  },
  {
    "organizer_id": 1,
    "organizer_name": "Alice Conrado",
    "title": "Yoga for Beginners",
    "description": "Embrace tranquility and wellness at our 'Yoga for Beginners' session, hosted by Alice Conrado at the Wellness Center on October 1, 2024. From 8:00 AM to 9:00 AM, this calming and restorative yoga class, priced at £10.00, is designed specifically for those new to yoga. Alice will guide you through fundamental poses and breathing techniques aimed at promoting relaxation, flexibility, and mental clarity. The session is tailored to help beginners build confidence and establish a solid foundation in yoga practice. Set in the serene environment of the Wellness Center, located at 22 Peace Avenue, Manchester, this class offers a gentle introduction to yoga that emphasizes mindfulness and self-care. Whether you're looking to relieve stress, improve your physical health, or simply find a peaceful start to your day, this workshop provides a perfect opportunity to embark on your yoga journey.",
    "start_time": "08:00",
    "end_time": "09:00",
    "date": "01-10-2024",
    "venue": "Wellness Center",
    "price": "10.00",
    "address": "22 Peace Avenue",
    "post_code": "M32HS",
    "city": "Manchester"
  },
  {
    "organizer_id": 2,
    "organizer_name": "Mark Anthony",
    "title": "Baking Basics: Bread and Pastries",
    "description": "Join us for a delightful culinary adventure at our 'Baking Basics: Bread and Pastries' workshop, led by the expert baker Mark Anthony at Baker's Delight on September 15, 2024. From 2:00 PM to 5:00 PM, this engaging session, priced at £25.00, will immerse you in the art of baking fresh, homemade bread and delectable pastries. Mark will walk you through essential techniques, including kneading dough, shaping loaves, and creating perfectly flaky pastries. You’ll gain hands-on experience with recipes that will allow you to bake delicious treats from scratch. The workshop emphasizes both traditional and innovative baking methods, ensuring you leave with a repertoire of skills and recipes. Set in the charming Baker's Delight, located at 47 Dough Lane, Salford, this event is perfect for anyone passionate about baking or eager to enhance their culinary skills. Join us for an afternoon of baking and learn how to make your kitchen the heart of your home.",
    "start_time": "14:00",
    "end_time": "17:00",
    "date": "15-09-2024",
    "venue": "Baker's Delight",
    "price": "25.00",
    "address": "47 Dough Lane",
    "post_code": "M21GT",
    "city": "Salford"
  },
  {
    "organizer_id": 3,
    "organizer_name": "Rafael Alessandro",
    "title": "Digital Art Workshop",
    "description": "Explore the vibrant world of digital creativity at our 'Digital Art Workshop,' hosted by Rafael Alessandro at the Art Hub on October 10, 2024. From 1:00 PM to 3:00 PM, this hands-on session, priced at £20.00, offers an in-depth look into digital painting techniques and tools. Rafael will guide you through the fundamentals of digital art, including the use of various software, brush techniques, and color theory. Participants will have the opportunity to experiment with different digital mediums and create their own unique artworks. The Art Hub, located at 5 Canvas Drive, Bolton, provides a dynamic and supportive environment for artists of all skill levels. Whether you’re a seasoned digital artist or a beginner eager to dive into the world of digital painting, this workshop offers valuable insights and practical experience in a creative and collaborative setting.",
    "start_time": "13:00",
    "end_time": "15:00",
    "date": "10-10-2024",
    "venue": "Art Hub",
    "price": "20.00",
    "address": "5 Canvas Drive",
    "post_code": "M9OP",
    "city": "Bolton"
  },
  {
    "organizer_id": 4,
    "organizer_name": "Alba Martines",
    "title": "Introduction to Photography",
    "description": "Capture the beauty around you with our 'Introduction to Photography' workshop, led by the talented Alba Martines at the Picture Perfect Studio on October 5, 2024. From 10:00 AM to 12:00 PM, this engaging session, priced at £15.00, provides an excellent foundation for aspiring photographers. Alba will introduce you to the basics of photography, including how to effectively use your camera’s settings, understand composition, and capture stunning images. The workshop covers essential techniques such as exposure, focus, and lighting, with practical exercises that help you apply what you've learned. Set in the inspiring Picture Perfect Studio, located at 19 Shutter Street, Stockport, this event is perfect for beginners looking to enhance their photographic skills and discover the art of visual storytelling. Join us for a morning of creativity and learning that will elevate your photography to new heights.",
    "start_time": "10:00",
    "end_time": "12:00",
    "date": "05-10-2024",
    "venue": "Picture Perfect Studio",
    "price": "15.00",
    "address": "19 Shutter Street",
    "post_code": "M43FG",
    "city": "Stockport"
  },
  {
    "organizer_id": 5,
    "organizer_name": "Fred Smith",
    "title": "Guitar Jam Session",
    "description": "Strum and groove at our 'Guitar Jam Session,' hosted by Fred Smith at Music Vibes on September 18, 2024. From 5:30 PM to 7:00 PM, this informal and lively session, priced at £12.00, invites guitar enthusiasts of all skill levels to come together for an evening of music and fun. Bring your guitar and join in on a spontaneous jam where you can play your favorite songs, experiment with new riffs, and collaborate with fellow musicians. Fred will facilitate the session, offering guidance and support to ensure everyone has a great time. The Music Vibes venue, located at 35 Melody Street, Rochdale, provides a vibrant and welcoming atmosphere for this musical gathering. Whether you're looking to showcase your talents, learn from others, or simply enjoy a relaxed jam session, this event promises an enjoyable experience for all.",
    "start_time": "17:30",
    "end_time": "19:00",
    "date": "18-09-2024",
    "venue": "Music Vibes",
    "price": "12.00",
    "address": "35 Melody Street",
    "post_code": "M10LJ",
    "city": "Rochdale"
  },
  {
    "organizer_id": 1,
    "organizer_name": "Alice Conrado",
    "title": "Kids' Coding Club",
    "description": "Welcome to the 'Kids' Coding Club,' a dynamic and engaging workshop specifically designed for children aged 8-12. Hosted by Alice Conrado at Techno Kids on October 12, 2024, from 3:00 PM to 4:30 PM, this session, priced at £8.00, offers a fun introduction to the world of coding. In this interactive environment, young learners will dive into basic programming concepts using child-friendly coding platforms. Alice will guide participants through exciting projects like creating simple games and animations, allowing them to see their ideas come to life. The workshop is designed to spark curiosity and encourage problem-solving skills while making coding accessible and enjoyable. Located at 50 Chip Road, Oldham, Techno Kids provides a perfect setting for this educational adventure. Join us to foster a love for technology and innovation in a supportive and stimulating atmosphere.",
    "start_time": "15:00",
    "end_time": "16:30",
    "date": "12-10-2024",
    "venue": "Techno Kids",
    "price": "8.00",
    "address": "50 Chip Road",
    "post_code": "M22ZR",
    "city": "Oldham"
  },
  {
    "organizer_id": 2,
    "organizer_name": "Mark Anthony",
    "title": "Salsa Dancing Night",
    "description": "Get ready to move and groove at our 'Salsa Dancing Night,' an exhilarating event hosted by Mark Anthony at Dance Fiesta on September 25, 2024. From 7:00 PM to 9:00 PM, this energetic evening, priced at £10.00, invites dancers of all levels to experience the vibrant rhythms and passionate moves of salsa. Whether you're a seasoned dancer or a complete novice, Mark will lead you through lively salsa steps and techniques in a fun and welcoming environment. The evening will feature a mix of instruction and open dancing, giving you the chance to practice your new moves and enjoy the infectious energy of salsa music. Located at 12 Salsa Street, Bury, Dance Fiesta provides the perfect backdrop for this festive night of dance. Don’t miss out on this opportunity to learn, dance, and have a blast!",
    "start_time": "19:00",
    "end_time": "21:00",
    "date": "25-09-2024",
    "venue": "Dance Fiesta",
    "price": "10.00",
    "address": "12 Salsa Street",
    "post_code": "M7NW",
    "city": "Bury"
  },
  {
    "organizer_id": 3,
    "organizer_name": "Rafael Alessandro",
    "title": "Chess Club Meetup",
    "description": "Join us for an engaging 'Chess Club Meetup,' hosted by Rafael Alessandro at Checkmate Hall on September 19, 2024. From 6:00 PM to 8:00 PM, this casual gathering, priced at £5.00, brings together chess enthusiasts of all skill levels for an evening of strategic play and friendly competition. Whether you’re a seasoned player or just starting out, you'll have the chance to challenge opponents, discuss strategies, and enjoy the camaraderie of fellow chess lovers. Rafael will facilitate the event, offering tips and insights to help improve your game. Set in the welcoming environment of Checkmate Hall, located at 9 Bishop's Court, Wigan, this meetup is the perfect opportunity to sharpen your chess skills and connect with others who share your passion for the game.",
    "start_time": "18:00",
    "end_time": "20:00",
    "date": "19-09-2024",
    "venue": "Checkmate Hall",
    "price": "5.00",
    "address": "9 Bishop's Court",
    "post_code": "M30XR",
    "city": "Wigan"
  },
  {
    "organizer_id": 4,
    "organizer_name": "Alba Martines",
    "title": "Cooking Class: Italian Cuisine",
    "description": "Embark on a culinary journey with our 'Cooking Class: Italian Cuisine,' hosted by Alba Martines at the Culinary Arts Center on September 1, 2024. From 2:00 PM to 5:00 PM, this hands-on class, priced at £35.00, invites you to master the art of Italian cooking. Alba will guide you through the preparation of classic Italian dishes such as homemade pasta, rich sauces, and delicious desserts. You’ll learn essential cooking techniques, from kneading and rolling dough to perfecting the balance of flavors in your dishes. The Culinary Arts Center, located at 16 Pasta Place, Ashton-under-Lyne, provides a fully equipped kitchen and a cozy atmosphere for this immersive cooking experience. Whether you're a budding chef or simply love Italian food, this class offers an opportunity to create mouthwatering dishes and enjoy a taste of Italy from the comfort of your own kitchen.",
    "start_time": "14:00",
    "end_time": "17:00",
    "date": "01-09-2024",
    "venue": "Culinary Arts Center",
    "price": "35.00",
    "address": "16 Pasta Place",
    "post_code": "M12PA",
    "city": "Ashton-under-Lyne"
  },
  {
    "organizer_id": 5,
    "organizer_name": "Fred Smith",
    "title": "Outdoor Painting Class",
    "description": "Unleash your creativity in the great outdoors with our 'Outdoor Painting Class,' hosted by Fred Smith at Artists' Park on October 7, 2024. From 10:00 AM to 12:30 PM, this inspiring session, priced at £20.00, invites painters of all levels to capture the beauty of nature on canvas. Surrounded by the picturesque scenery of Artists' Park, Fred will guide you through techniques for painting landscapes, capturing light and shadow, and creating vibrant compositions. The class emphasizes individual expression and offers personalized feedback to help you refine your skills. Located at 23 Easel Lane, Altrincham, Artists' Park provides a serene setting for this creative endeavor. Join us for a morning of painting and enjoy the therapeutic benefits of connecting with nature while developing your artistic talents.",
    "start_time": "10:00",
    "end_time": "12:30",
    "date": "07-10-2024",
    "venue": "Artists' Park",
    "price": "20.00",
    "address": "23 Easel Lane",
    "post_code": "M18GL",
    "city": "Altrincham"
  },
  {
    "organizer_id": 1,
    "organizer_name": "Alice Conrado",
    "title": "Mindfulness Meditation",
    "description": "Find your inner peace with our 'Mindfulness Meditation' session, led by Alice Conrado at Serenity Studio on October 8, 2024. From 9:00 AM to 10:00 AM, this calming session, priced at £10.00, offers a gentle introduction to mindfulness and meditation techniques. Alice will guide you through practices designed to help you relax, focus on the present moment, and cultivate a sense of inner tranquility. The session will include breathing exercises, guided visualizations, and mindfulness practices that can be easily incorporated into daily life. Set in the serene environment of Serenity Studio, located at 29 Calm Crescent, Manchester, this workshop provides a perfect opportunity to de-stress and rejuvenate. Whether you are new to meditation or seeking to deepen your practice, this session offers valuable tools for enhancing well-being and mental clarity.",
    "start_time": "09:00",
    "end_time": "10:00",
    "date": "08-10-2024",
    "venue": "Serenity Studio",
    "price": "10.00",
    "address": "29 Calm Crescent",
    "post_code": "M23PE",
    "city": "Manchester"
  },
  {
    "organizer_id": 2,
    "organizer_name": "Mark Anthony",
    "title": "Film Screening: Classic Cinema",
    "description": "Immerse yourself in the magic of classic films at our 'Film Screening: Classic Cinema,' hosted by Mark Anthony at Movie Magic Hall on September 24, 2024. From 6:30 PM to 9:00 PM, this delightful event, priced at £8.00, features a screening of a timeless film followed by a lively discussion with fellow movie enthusiasts. The evening begins with the screening of a carefully selected classic film, offering a chance to enjoy cinematic history on the big screen. After the film, join in a group discussion where you can share your thoughts, insights, and favorite moments with other attendees. The Movie Magic Hall, located at 14 Reel Avenue, Salford, provides a nostalgic and cozy atmosphere for this cinematic experience. Whether you're a film aficionado or just love classic movies, this event promises an enjoyable evening of film and conversation.",
    "start_time": "18:30",
    "end_time": "21:00",
    "date": "24-09-2024",
    "venue": "Movie Magic Hall",
    "price": "8.00",
    "address": "14 Reel Avenue",
    "post_code": "M40BC",
    "city": "Salford"
  },
  {
    "organizer_id": 3,
    "organizer_name": "Rafael Alessandro",
    "title": "Advanced Photography Techniques",
    "description": "Elevate your photography skills with our 'Advanced Photography Techniques' workshop, hosted by Rafael Alessandro at Lens Masters on October 14, 2024. From 11:00 AM to 1:00 PM, this comprehensive session, priced at £25.00, delves into advanced techniques that will help you take your photography to the next level. Rafael will cover key aspects such as sophisticated lighting techniques, advanced composition strategies, and post-processing tips. The workshop includes practical exercises and real-time feedback to refine your skills and enhance your creative vision. Set in the inspiring environment of Lens Masters, located at 8 Focus Road, Bolton, this event provides a perfect setting for learning and growth. Whether you're looking to refine your professional skills or enhance your personal photography, this workshop offers valuable insights and hands-on experience to help you achieve your artistic goals.",
    "start_time": "11:00",
    "end_time": "13:00",
    "date": "14-10-2024",
    "venue": "Lens Masters",
    "price": "25.00",
    "address": "8 Focus Road",
    "post_code": "M24XY",
    "city": "Bolton"
  },
  {
    "organizer_id": 4,
    "organizer_name": "Alba Martines",
    "title": "Introduction to Yoga",
    "description": "Experience a soothing start to your day with our 'Introduction to Yoga' class, led by Alba Martines at Tranquil Spaces on October 11, 2024. From 8:00 AM to 9:30 AM, this gentle session, priced at £12.00, offers a calming introduction to yoga for beginners and those seeking relaxation. Alba will guide you through fundamental yoga poses, breathing exercises, and mindfulness techniques, focusing on enhancing flexibility and promoting mental well-being. Tranquil Spaces, located at 55 Zen Way, Stockport, provides a serene and welcoming environment for this rejuvenating experience. Whether you are new to yoga or looking for a peaceful start to your day, this class offers a perfect opportunity to cultivate a sense of inner calm and balance.",
    "start_time": "08:00",
    "end_time": "09:30",
    "date": "11-10-2024",
    "venue": "Tranquil Spaces",
    "price": "12.00",
    "address": "55 Zen Way",
    "post_code": "M38PJ",
    "city": "Stockport"
  },
  {
    "organizer_id": 5,
    "organizer_name": "Fred Smith",
    "title": "Beginner's Guide to Watercolor",
    "description": "Discover the art of watercolor painting with our 'Beginner's Guide to Watercolor' class, hosted by Fred Smith at Art Splash Studio on September 6, 2024. From 2:00 PM to 4:00 PM, this introductory session, priced at £18.00, is designed for those new to watercolor. Fred will introduce you to essential techniques such as color mixing, brushwork, and creating beautiful washes. The class includes hands-on practice and personalized guidance to help you develop your skills and create your own watercolor artwork. Located at 77 Palette Court, Rochdale, Art Splash Studio offers a creative and supportive environment for this artistic exploration. Join us to embrace your creativity and start your journey into the world of watercolor painting.",
    "start_time": "14:00",
    "end_time": "16:00",
    "date": "06-09-2024",
    "venue": "Art Splash Studio",
    "price": "18.00",
    "address": "77 Palette Court",
    "post_code": "M35GH",
    "city": "Rochdale"
  },
  {
    "organizer_id": 1,
    "organizer_name": "Alice Conrado",
    "title": "Advanced Python Programming",
    "description": "Elevate your programming skills with our 'Advanced Python Programming' workshop, hosted by Alice Conrado at Tech Hub on October 12, 2024. From 9:00 AM to 11:00 AM, this intensive session, priced at £25.00, delves into advanced Python concepts including Object-Oriented Programming (OOP), decorators, and more. Alice will guide you through complex topics and practical coding exercises designed to enhance your understanding and application of advanced Python techniques. Whether you're looking to refine your skills for professional development or personal projects, this workshop offers valuable insights and hands-on experience. Tech Hub, located at 101 Innovation Drive, Manchester, provides a cutting-edge environment for this advanced learning experience. Join us to deepen your Python expertise and tackle more sophisticated programming challenges.",
    "start_time": "09:00",
    "end_time": "11:00",
    "date": "12-10-2024",
    "venue": "Tech Hub",
    "price": "25.00",
    "address": "101 Innovation Drive",
    "post_code": "M15JU",
    "city": "Manchester"
  },
  {
    "organizer_id": 2,
    "organizer_name": "Mark Anthony",
    "title": "Beginner's Yoga Class",
    "description": "Start your yoga journey with our 'Beginner's Yoga Class,' led by Mark Anthony at Wellness Center on October 15, 2024. From 7:00 AM to 8:30 AM, this peaceful session, priced at £10.00, focuses on introducing the fundamentals of yoga. Mark will guide you through basic poses, breathing techniques, and mindfulness practices aimed at improving flexibility and promoting relaxation. The class is designed for those new to yoga or looking for a gentle introduction to the practice. Located at 22 Harmony Street, Salford, Wellness Center offers a serene setting for this enriching experience. Join us to build a foundation in yoga and enhance your well-being through mindful movement and relaxation.",
    "start_time": "07:00",
    "end_time": "08:30",
    "date": "15-10-2024",
    "venue": "Wellness Center",
    "price": "10.00",
    "address": "22 Harmony Street",
    "post_code": "M22YR",
    "city": "Salford"
  },
  {
    "organizer_id": 3,
    "organizer_name": "Rafael Alessandro",
    "title": "Cooking Masterclass: Italian Cuisine",
    "description": "Immerse yourself in the flavors of Italy with our 'Cooking Masterclass: Italian Cuisine,' hosted by Rafael Alessandro at Culinary Arts Studio on October 19, 2024. From 6:00 PM to 8:30 PM, this comprehensive class, priced at £35.00, provides a hands-on experience in preparing authentic Italian dishes. Rafael will teach you how to create classic Italian recipes, including pasta, sauces, and desserts, using traditional techniques and high-quality ingredients. The masterclass includes demonstrations, practical cooking sessions, and tips for perfecting your culinary skills. Located at 7 Gourmet Lane, Bolton, Culinary Arts Studio offers a well-equipped kitchen and a welcoming atmosphere for this gastronomic adventure. Join us to expand your cooking repertoire and enjoy a taste of Italy.",
    "start_time": "18:00",
    "end_time": "20:30",
    "date": "19-10-2024",
    "venue": "Culinary Arts Studio",
    "price": "35.00",
    "address": "7 Gourmet Lane",
    "post_code": "M34WE",
    "city": "Bolton"
  },
  {
    "organizer_id": 4,
    "organizer_name": "Alba Martines",
    "title": "Photography Basics",
    "description": "Learn the fundamentals of photography with our 'Photography Basics' class, hosted by Alba Martines at City Arts Center on October 21, 2024. From 2:00 PM to 4:00 PM, this introductory session, priced at £20.00, covers essential topics including camera settings, composition, and lighting techniques. Alba will provide practical insights and hands-on exercises to help you understand how to use your camera effectively and capture stunning images. The class is suitable for beginners and those looking to refresh their photography skills. City Arts Center, located at 19 Lens Avenue, Stockport, offers a creative environment for this educational workshop. Join us to enhance your photography skills and start capturing beautiful moments.",
    "start_time": "14:00",
    "end_time": "16:00",
    "date": "21-10-2024",
    "venue": "City Arts Center",
    "price": "20.00",
    "address": "19 Lens Avenue",
    "post_code": "M44HS",
    "city": "Stockport"
  },
  {
    "organizer_id": 5,
    "organizer_name": "Fred Smith",
    "title": "Creative Writing Workshop",
    "description": "Unlock your storytelling potential with our 'Creative Writing Workshop,' led by Fred Smith at Writer's Corner on October 25, 2024. From 10:00 AM to 12:00 PM, this engaging session, priced at £15.00, focuses on developing creative writing skills. Fred will guide you through various writing techniques, including character development, plot structuring, and narrative voice. The workshop includes writing exercises, group discussions, and feedback to help you refine your craft and inspire your creativity. Located at 3 Story Road, Rochdale, Writer's Corner provides a supportive and inspiring environment for writers of all levels. Join us to explore your creativity and enhance your writing skills.",
    "start_time": "10:00",
    "end_time": "12:00",
    "date": "25-10-2024",
    "venue": "Writer's Corner",
    "price": "15.00",
    "address": "3 Story Road",
    "post_code": "M56YU",
    "city": "Rochdale"
  },
  {
    "organizer_id": 1,
    "organizer_name": "Alice Conrado",
    "title": "Music Production for Beginners",
    "description": "Dive into the world of music production with our 'Music Production for Beginners' workshop, hosted by Alice Conrado at SoundLab Studio on October 28, 2024. From 1:00 PM to 3:00 PM, this comprehensive session, priced at £30.00, offers an introduction to the basics of music production using industry-standard software. Alice will walk you through key concepts such as recording, mixing, and editing music, providing hands-on experience with professional tools. Whether you're an aspiring musician or simply interested in the technical side of music, this workshop offers valuable insights and practical skills. Located at 55 Beat Street, Oldham, SoundLab Studio provides a cutting-edge environment for this immersive learning experience. Join us to start your journey into music production and explore your creative potential.",
    "start_time": "13:00",
    "end_time": "15:00",
    "date": "28-10-2024",
    "venue": "SoundLab Studio",
    "price": "30.00",
    "address": "55 Beat Street",
    "post_code": "M62GH",
    "city": "Oldham"
  },
  {
    "organizer_id": 2,
    "organizer_name": "Mark Anthony",
    "title": "Introduction to Meditation",
    "description": "Discover the fundamentals of meditation with our 'Introduction to Meditation' session, hosted by Mark Anthony at Peaceful Mind Center on November 1, 2024. From 6:30 PM to 7:30 PM, this insightful class, priced at £8.00, will guide you through the basics of meditation techniques and how to incorporate them into your daily life. Mark will introduce you to various meditation practices aimed at reducing stress, enhancing focus, and promoting overall well-being. The session takes place in a tranquil setting at 29 Calm Crescent, Bury, providing a serene environment for relaxation and mindfulness. Join us to learn how meditation can positively impact your life and cultivate a sense of inner peace.",
    "start_time": "18:30",
    "end_time": "19:30",
    "date": "01-11-2024",
    "venue": "Peaceful Mind Center",
    "price": "8.00",
    "address": "29 Calm Crescent",
    "post_code": "M72PR",
    "city": "Bury"
  },
  {
    "organizer_id": 3,
    "organizer_name": "Rafael Alessandro",
    "title": "Art Therapy Workshop",
    "description": "Explore the therapeutic benefits of art with our 'Art Therapy Workshop,' led by Rafael Alessandro at Healing Arts Center on November 3, 2024. From 3:00 PM to 5:00 PM, this expressive workshop, priced at £12.00, offers a creative outlet for emotional expression and stress relief. Rafael will guide you through various art techniques designed to help you process emotions and promote mental well-being. The workshop includes hands-on activities and personal reflection, making it a valuable experience for those seeking a creative approach to emotional health. Located at 45 Serenity Street, Wigan, Healing Arts Center provides a supportive and calming atmosphere for this therapeutic exploration. Join us to discover how art can be a powerful tool for personal growth and stress management.",
    "start_time": "15:00",
    "end_time": "17:00",
    "date": "03-11-2024",
    "venue": "Healing Arts Center",
    "price": "12.00",
    "address": "45 Serenity Street",
    "post_code": "M84HT",
    "city": "Wigan"
  },
  {
    "organizer_id": 4,
    "organizer_name": "Alba Martines",
    "title": "Digital Marketing Basics",
    "description": "Get to grips with the essentials of digital marketing in our 'Digital Marketing Basics' workshop, hosted by Alba Martines at Marketing Hub on November 5, 2024. From 9:00 AM to 11:30 AM, this informative session, priced at £20.00, covers key topics such as SEO, social media marketing, and online advertising. Alba will provide practical insights and strategies to help you effectively promote your business or project in the digital landscape. The workshop includes interactive discussions and real-world examples to enhance your understanding of digital marketing techniques. Located at 88 Ads Avenue, Ashton-under-Lyne, Marketing Hub offers a professional environment for this valuable learning experience. Join us to build your digital marketing skills and achieve greater online visibility.",
    "start_time": "09:00",
    "end_time": "11:30",
    "date": "05-11-2024",
    "venue": "Marketing Hub",
    "price": "20.00",
    "address": "88 Ads Avenue",
    "post_code": "M95BR",
    "city": "Ashton-under-Lyne"
  },
  {
    "organizer_id": 5,
    "organizer_name": "Fred Smith",
    "title": "Local History and Architecture Tour",
    "description": "Immerse yourself in the rich history and architecture of the city with our 'Local History and Architecture Tour,' led by Fred Smith at City Hall on November 8, 2024. From 2:30 PM to 4:30 PM, this engaging tour, priced at £10.00, explores significant historical landmarks and architectural marvels. Fred will provide expert commentary and insights into the city's past and its architectural evolution. The tour offers a fascinating look at the historical and cultural heritage of the area. Located at 6 Heritage Square, Altrincham, City Hall serves as the starting point for this informative and visually stimulating journey. Join us to discover the stories behind the city's most iconic buildings and learn more about its architectural legacy.",
    "start_time": "14:30",
    "end_time": "16:30",
    "date": "08-11-2024",
    "venue": "City Hall",
    "price": "10.00",
    "address": "6 Heritage Square",
    "post_code": "M10RT",
    "city": "Altrincham"
  },
  {
    "organizer_id": 1,
    "organizer_name": "Alice Conrado",
    "title": "Sustainable Living Workshop",
    "description": "Embrace a more eco-friendly lifestyle with our 'Sustainable Living Workshop,' hosted by Alice Conrado at Eco Center on November 12, 2024. From 11:00 AM to 1:00 PM, this practical session, priced at £12.50, offers valuable tips and strategies for living sustainably. Alice will cover various aspects of sustainable living, including waste reduction, energy efficiency, and eco-friendly practices. The workshop includes actionable advice and resources to help you make positive changes in your daily life. Located at 22 Green Way, Manchester, Eco Center provides an ideal setting for this informative and inspiring workshop. Join us to learn how you can contribute to a more sustainable future and incorporate green practices into your lifestyle.",
    "start_time": "11:00",
    "end_time": "13:00",
    "date": "12-11-2024",
    "venue": "Eco Center",
    "price": "12.50",
    "address": "22 Green Way",
    "post_code": "M11GW",
    "city": "Manchester"
  },
  {
    "organizer_id": 2,
    "organizer_name": "Mark Anthony",
    "title": "Guitar Jam Session",
    "description": "Join fellow musicians for a fun 'Guitar Jam Session,' hosted by Mark Anthony at Music Lounge on November 14, 2024. From 6:00 PM to 8:00 PM, this informal session, priced at £5.00, is open to guitarists of all levels who want to jam and share their love of music. Bring your guitar and enjoy a relaxed environment where you can play, collaborate, and experiment with other musicians. The session encourages creativity and musical expression in a supportive setting. Located at 77 Strings Street, Salford, Music Lounge offers a welcoming space for this musical gathering. Whether you're looking to connect with other guitarists or simply enjoy a musical evening, this jam session provides a great opportunity to play and have fun.",
    "start_time": "18:00",
    "end_time": "20:00",
    "date": "14-11-2024",
    "venue": "Music Lounge",
    "price": "5.00",
    "address": "77 Strings Street",
    "post_code": "M23RK",
    "city": "Salford"
  },
  {
    "organizer_id": 3,
    "organizer_name": "Rafael Alessandro",
    "title": "Advanced Photography Techniques",
    "description": "Take your photography skills to new heights with our 'Advanced Photography Techniques' workshop, led by Rafael Alessandro at Photo Studio on November 17, 2024. From 9:00 AM to 11:30 AM, this detailed session, priced at £18.00, delves into advanced photography techniques, including lighting, composition, and post-processing. Rafael will provide expert guidance and hands-on practice to help you enhance your photographic abilities and achieve professional-quality results. The workshop is designed for photographers with a basic understanding of photography who want to refine their skills and explore more complex concepts. Located at 44 Capture Lane, Bolton, Photo Studio offers a well-equipped environment for this advanced learning experience. Join us to elevate your photography skills and capture stunning images with greater expertise.",
    "start_time": "09:00",
    "end_time": "11:30",
    "date": "17-11-2024",
    "venue": "Photo Studio",
    "price": "18.00",
    "address": "44 Capture Lane",
    "post_code": "M35JU",
    "city": "Bolton"
  },
  {
    "organizer_id": 4,
    "organizer_name": "Alba Martines",
    "title": "Fitness Bootcamp",
    "description": "Get energized with our 'Fitness Bootcamp,' hosted by Alba Martines at City Park on November 19, 2024. From 7:00 AM to 8:00 AM, this high-energy bootcamp session, priced at £7.50, offers a challenging workout designed to boost your fitness and kickstart your day. Alba will lead you through a dynamic workout that includes strength training, cardio, and functional exercises, aiming to improve overall fitness and endurance. The session is suitable for participants of various fitness levels and provides a fun and motivating environment. Located at 33 Workout Way, Stockport, City Park offers ample space for this vigorous fitness session. Join us to get fit, stay active, and enjoy a high-intensity workout that will help you reach your fitness goals.",
    "start_time": "07:00",
    "end_time": "08:00",
    "date": "19-11-2024",
    "venue": "City Park",
    "price": "7.50",
    "address": "33 Workout Way",
    "post_code": "M46PT",
    "city": "Stockport"
  },
  {
    "organizer_id": 5,
    "organizer_name": "Fred Smith",
    "title": "Introduction to Painting",
    "description": "Unleash your creativity with our 'Introduction to Painting' class, hosted by Fred Smith at Art Studio on November 22, 2024. From 10:00 AM to 12:00 PM, this beginner-friendly session, priced at £15.00, explores the basics of painting with various mediums. Fred will introduce you to essential painting techniques, color theory, and brushwork, providing hands-on instruction and support as you create your own artwork. The class is designed for those new to painting or looking to improve their skills in a relaxed and encouraging environment. Located at 9 Canvas Road, Rochdale, Art Studio offers a creative space for this artistic exploration. Join us to start your painting journey and develop your artistic talents.",
    "start_time": "10:00",
    "end_time": "12:00",
    "date": "22-11-2024",
    "venue": "Art Studio",
    "price": "15.00",
    "address": "9 Canvas Road",
    "post_code": "M57YT",
    "city": "Rochdale"
  }
]
